{
  "schema_version": 1,
  "task": "Task 009",
  "slug": "ios-ui-prototype",
  "title": "iOS UI prototype of the core loop (Milestone 002, UI-first)",
  "agent": "Claude Code (claude-opus-4-7[1m])",
  "source_language": "Japanese",
  "published_language": "English",
  "translation_policy": "Faithful English translation of the original Japanese prompt and visible AI interaction used during development. No summary, beautification, or added requirements. Code, commands, file paths, URLs, identifiers, and error messages are kept in their original form.",
  "human_directed": true,
  "prompt_path": "prompt.en.md",
  "transcript_path": "transcript.en.md",
  "repository": "sugie/wildlive",
  "branch": "ai/013-ios-ui-prototype",
  "base_commit": "17bfb8b",
  "pr_number": null,
  "pr_url": null,
  "merge_commit": null,
  "ci_status": null,
  "post_merge_ci_status": null,
  "report_en": "docs/reports/en/task-009-ios-ui-prototype.html",
  "report_ja": "docs/reports/ja/task-009-ios-ui-prototype.html",
  "x_manifest": null,
  "notes": "Stacked on ai/011-ios-title-screen (base_commit 17bfb8b) because Task 008's title screen (PR #12) is still open on that branch. When PR #12 merges into main, this branch will be re-based / re-targeted onto main. No X manifest per the Milestone 001 §27 precedent for pre-review UI-only iterations. pr_number / pr_url / merge_commit / ci_status remain null until the human authorises push + PR + merge."
}
