{
  "schema_version": 1,
  "task": "Task 006",
  "slug": "postgres-15-standardization",
  "title": "Standardize development and CI on PostgreSQL 15",
  "agent": "Claude Code (claude-opus-4-7[1m])",
  "source_language": "Japanese",
  "published_language": "English",
  "translation_policy": "Faithful English translation of the original Japanese prompt and visible AI interaction used during development. No summary, beautification, or added requirements. Code, commands, file paths, URLs, identifiers, and error messages are kept in their original form.",
  "human_directed": true,
  "prompt_path": "prompt.en.md",
  "transcript_path": "transcript.en.md",
  "repository": "sugie/wildlive",
  "branch": "ai/009-postgres-15-standardization",
  "base_commit": "8d113ec",
  "pr_number": 10,
  "pr_url": "https://github.com/sugie/wildlive/pull/10",
  "merge_commit": null,
  "ci_status": null,
  "post_merge_ci_status": null,
  "report_en": "docs/reports/en/task-006-postgres-15-standardization.html",
  "report_ja": "docs/reports/ja/task-006-postgres-15-standardization.html",
  "x_manifest": "docs/social/x/task-006-postgres-15-standardization.json",
  "notes": "pr_number and pr_url are backfilled in a follow-up commit on this branch once the PR is opened. merge_commit / ci_status / post_merge_ci_status remain null in the shipped record and are always verifiable via the linked pr_url."
}
