{
  "schema_version": 1,
  "task": "Task 007",
  "slug": "postgres-17-restandardization",
  "title": "Restandardize development and CI on PostgreSQL 17 with pgvector",
  "agent": "Claude Code (claude-opus-4-7[1m])",
  "source_language": "Japanese",
  "published_language": "English",
  "translation_policy": "Faithful English translation of the original Japanese prompt and visible AI interaction used during development. No summary, beautification, or added requirements. Code, commands, file paths, URLs, identifiers, and error messages are kept in their original form.",
  "human_directed": true,
  "prompt_path": "prompt.en.md",
  "transcript_path": "transcript.en.md",
  "repository": "sugie/wildlive",
  "branch": "ai/010-postgres-17-restandardization",
  "base_commit": "9927754",
  "pr_number": 11,
  "pr_url": "https://github.com/sugie/wildlive/pull/11",
  "merge_commit": null,
  "ci_status": null,
  "post_merge_ci_status": null,
  "report_en": "docs/reports/en/task-007-postgres-17-restandardization.html",
  "report_ja": "docs/reports/ja/task-007-postgres-17-restandardization.html",
  "x_manifest": "docs/social/x/task-007-postgres-17-restandardization.json",
  "notes": "The human explicitly withheld push / PR / merge authorisation for this task. This branch will sit locally until the human authorises the next step. pr_number, pr_url, merge_commit, ci_status, post_merge_ci_status therefore remain null and will be backfilled only if and when the PR is opened."
}
