{
  "schema_version": 1,
  "task": "Task 008",
  "slug": "ios-title-screen",
  "title": "iOS title screen (Milestone 001, UI-first)",
  "agent": "Claude Code (claude-opus-4-7[1m])",
  "source_language": "Japanese",
  "published_language": "English",
  "translation_policy": "Faithful English translation of the original Japanese prompt and visible AI interaction used during development. No summary, beautification, or added requirements. Code, commands, file paths, URLs, identifiers, and error messages are kept in their original form.",
  "human_directed": true,
  "prompt_path": "prompt.en.md",
  "transcript_path": "transcript.en.md",
  "repository": "sugie/wildlive",
  "branch": "ai/011-ios-title-screen",
  "base_commit": "7505e18",
  "pr_number": null,
  "pr_url": null,
  "merge_commit": null,
  "ci_status": null,
  "post_merge_ci_status": null,
  "report_en": "docs/reports/en/task-008-ios-title-screen.html",
  "report_ja": "docs/reports/ja/task-008-ios-title-screen.html",
  "x_manifest": null,
  "notes": "First UI-first milestone. Deliberately no X manifest per Milestone 001 brief §27 (Version-0 UI screen is not itself an auto-post-on-merge target). pr_number and pr_url are backfilled once the PR is opened. merge_commit and post_merge_ci_status stay null until (and unless) the human authorises the merge in a subsequent instruction."
}
