{
  "schema_version": 1,
  "task": "Task 010",
  "slug": "player-registration",
  "title": "First-time Player registration end-to-end (Milestone 002)",
  "agent": "Claude Code (claude-opus-4-7[1m])",
  "source_language": "Japanese",
  "published_language": "English",
  "translation_policy": "Faithful English translation of the original Japanese prompt and visible AI interaction used during development. No summary, beautification, or added requirements. Code, commands, file paths, URLs, identifiers, and error messages are kept in their original form.",
  "human_directed": true,
  "prompt_path": "prompt.en.md",
  "transcript_path": "transcript.en.md",
  "repository": "sugie/wildlive",
  "branch": "ai/014-player-registration",
  "base_commit": "c20e8bd",
  "pr_number": null,
  "pr_url": null,
  "merge_commit": null,
  "ci_status": null,
  "post_merge_ci_status": null,
  "report_en": "docs/reports/en/task-010-player-registration.html",
  "report_ja": "docs/reports/ja/task-010-player-registration.html",
  "x_manifest": null,
  "notes": "First real vertical slice for WildLive: iPhone Simulator → SwiftUI → Laravel API → PostgreSQL for first-time player registration. Stacked on ai/013-ios-ui-prototype (base_commit c20e8bd), which itself stacks on ai/011-ios-title-screen (PR #12, still open). When PR #12 merges and ai/013 merges, this branch will re-target main automatically. No X manifest per the Milestone 001 §27 precedent — pre-review UI-visible iterations are not themselves auto-post-on-merge targets. pr_number / pr_url / merge_commit / ci_status remain null until the human authorises push + PR + merge."
}
