{
  "schema_version": 1,
  "task": "Task 005",
  "slug": "public-ai-session-archive",
  "title": "Public AI Development Archive",
  "agent": "Claude Code (claude-opus-4-7[1m])",
  "source_language": "Japanese",
  "published_language": "English",
  "translation_policy": "Faithful English translation of the original Japanese prompt and visible AI interaction used during development. No summary, beautification, or added requirements. Code, commands, file paths, URLs, identifiers, and error messages are kept in their original form.",
  "human_directed": true,
  "prompt_path": "prompt.en.md",
  "transcript_path": "transcript.en.md",
  "repository": "sugie/wildlive",
  "branch": "ai/008-public-ai-session-archive",
  "base_commit": "52f354a",
  "pr_number": 9,
  "pr_url": "https://github.com/sugie/wildlive/pull/9",
  "merge_commit": null,
  "ci_status": null,
  "post_merge_ci_status": null,
  "report_en": "docs/reports/en/task-005-public-ai-session-archive.html",
  "report_ja": "docs/reports/ja/task-005-public-ai-session-archive.html",
  "x_manifest": "docs/social/x/task-005-public-ai-session-archive.json",
  "notes": "Post-merge fields (pr_number, pr_url, merge_commit, ci_status, post_merge_ci_status) are null at author time. pr_number and pr_url are filled in a follow-up commit on this branch after the PR is opened. merge_commit and post_merge_ci_status stay null unless filled by a later small PR; they are always verifiable via the linked pr_url."
}
